{
  "schema_version": "1.0",
  "request_id": "55555555-5555-4555-8555-555555555555",
  "events": [
    {
      "event_type": "BUG_REPORTED",
      "business_status": "REPORTED",
      "summary": "Client reported Google Login failure.",
      "occurred_at": "2026-10-12T09:00:00Z",
      "source_refs": [
        "source:22222222-2222-4222-8222-222222222222"
      ],
      "review_required": true
    }
  ],
  "warnings": []
}
